項次,工會屬性,工會名稱,理事長,郵遞區號,通訊地址,聯絡電話
593,產業工會,臺北市電影業產業工會,張石華,115,臺北市南港區重陽路263巷2號4樓,(02)23144996
594,產業工會,臺北市廣播電視產業工會,趙金虎,104,臺北市中山區復興北路62號3樓之2,(02)27888782
595,產業工會,臺北市演藝業產業工會,陳桓浩,104,臺北市中山區復興北路62號3樓之2,(02)25151580
596,產業工會,臺北市娛樂休閒業產業工會,樊芳銘,104,臺北市中山區復興北路62號3樓之2,(02)25151580
597,產業工會,臺北市地方戲曲劇團產業工會,陳桓浩,104,臺北市中山區復興北路62號3樓之2,(02)25151580
598,產業工會,臺北市流行音樂產業工會,曹莉,104,臺北市中山區復興北路62號3樓之2,(02)25151580
599,產業工會,臺北市珠寶業產業工會,李志忠,103,臺北市大同區赤峰街23巷11號3樓,(02)25151580
600,產業工會,臺灣美甲彩妝整體造型產業工會,林政翰,104,臺北市中山區吉林路239號7樓,(02)25582782
601,產業工會,臺灣保險服務產業工會,黃淑惠,100,臺北市中正區忠孝西路1段50號13樓之38,(02)25118574
602,產業工會,臺北市美甲彩妝整體造型產業工會,林政翰,104,臺北市中山區南京東路2段176號2樓,(02)23610216
603,產業工會,臺北市教育產業工會,李榖生,103,臺北市大同區赤峰街23巷11號3樓,(02)25095358
604,產業工會,臺北市環保資源再生產業工會,曾吉宏,111,臺北市士林區延平北路8段7號1樓,(02)25582782
605,產業工會,全國金融服務業產業工會,顏國裕,112,臺北市北投區中央北路1段2號4樓,(02)28107405
606,產業工會,台灣高等教育產業工會,周平,104,臺北市中山區伊通街59巷6號4樓,(02)23254852
607,產業工會,中華環保資源再生產業工會,曾志上,111,臺北市士林區延平北路8段2巷63弄5號1樓,(02)25077391
608,產業工會,臺灣護理產業工會,羅運生,106,臺北市大安區泰順街26巷39號2樓,(02)28107405
609,產業工會,臺灣資訊服務產業工會,戴文明,100,臺北市中正區忠孝西路1段50號13樓之38,(02)28267226
610,產業工會,臺北市身心障礙就業服務人員產業工會,簡明山,108,臺北市萬華區東園街73巷24號1樓,(02)23610896
611,產業工會,台灣旅遊觀光產業工會,林凱中,100,臺北市中正區忠孝東路1段85號12樓之1,(02)25598518
612,產業工會,航空運輸產業工會,李昭平,105,"臺北市松山區南京東四段53巷10弄2號
暫遷：台北市松山區民生東路五段175號14樓之7(109.9.14)           去電無人接聽",(02)23577073
613,產業工會,全國工會服務業產業工會,楊書瑋,112,臺北市中正區林森南路4-2號4樓,
614,產業工會,臺北市傳統整復推拿師產業工會,黃世嵐,104,臺北市中山區中山北路2段93巷9之4號1樓,(02)23217648
615,產業工會,臺灣新聞傳播產業工會,陳曉宜,106,臺北市大安區信義路2段88號9樓,(02)25231568
616,產業工會,台灣基層護理產業工會,卓淑惠,251,新北市淡水區中正路5巷26號2樓,(02)23410044
617,產業工會,臺北市社區大學教育產業工會,張琬君,103,臺北市大同區甘谷街40號,
618,產業工會,臺灣證券期貨產業工會,竇偉誠,235,"新北市中和區中原街152號12樓
(舊地址：新北市中和區中原東街88號6樓)",(02)25556008
619,產業工會,全國金融商品行銷人員產業工會,李永恒,108,臺北市萬華區艋舺大道120巷38弄45號3樓,(02)29597391
620,產業工會,臺灣文化創意拼布產業工會,陳余?,104,臺北市中山區松江路131號7樓-1,(02)25500827
621,產業工會,臺灣教育產業工會,張旭政,104,臺北市中山區民權西路27號2樓,(02)28929495
622,產業工會,臺北市直銷產業工會,林恩豪,104,台北市中山區民生東路一段 54 號 11 樓,(02)25857528
623,產業工會,中華殯葬禮儀事業產業工會,邱文金,220,新北市板橋區民生路2段234巷24弄6號2樓,(02)25673302
624,產業工會,台灣婚慶產業工會,曾傳灝,104,臺北市中山區民權東路1段7巷11號,(02)22561679
625,產業工會,臺北市保險產業工會,林恩永,104,臺北市中山區民生東路一段54號11樓,
626,產業工會,臺北市指甲彩繪睫毛業產業工會,許妙琪,106,臺北市大安區忠孝東路4段191號5樓之1,(02)22561679
627,產業工會,基北中等教育產業工會,黃文龍,105,臺北市松山區民生東路5段69巷3弄26號,
628,產業工會,全國土地開發產業工會,翁聖儒,110,臺北市信義區忠孝東路五段386號6樓,(02)22626097
629,產業工會,臺北市不動產仲介產業工會,廖年豐,116,臺北市文山區景華街21號1樓,(02)27233366
630,產業工會,台北市觀光餐旅產業工會,廖年茂,104,臺北市中山區民權西路20號5樓之12,(02)29349828
631,產業工會,臺北市裝潢產業工會,林錫維,104,台北市中山區民生東路一段 54 號 11 樓,(02)25214525
632,產業工會,中華勞務服務產業工會,廖茂霖,105,臺北市松山區八德路3段230號3樓之1,(02)25719188
633,產業工會,中華餐飲業產業工會,謝豐如,116,臺北市文山區景華街47號,(02)66172008
634,產業工會,臺北市生技產業工會,張奎懷,103,臺北市大同區赤峰街23巷11號3樓,(02)29325187
635,產業工會,臺北市公務機關基層勞工產業工會,林國棟,108,臺北市萬華區富民路145巷35弄8號3樓,(02)25582782
636,產業工會,臺灣教育人員產業工會,楊益風,103,臺北市大同區大龍街187巷1號,
637,產業工會,臺灣鐵路產業工會,王傑,104,臺北市中山區吉林路200巷16號1樓,(02)23032874
638,產業工會,台北市學校教育產業工會,鐘文斌,100,臺北市中正區公園路29號,
639,產業工會,全國傳播媒體產業工會,嚴文廷,108,臺北市萬華區萬大路184號2樓,(02)23112989
640,產業工會,臺北市教育局中小學產業工會,薛晨均,108,臺北市萬華區西園路2段281巷22號2樓,(02)23396172
641,產業工會,臺灣專櫃暨銷售人員產業工會,陳微淳,106,臺北市大安區新生南路1段60巷6號1樓,(02)25972631
642,產業工會,臺灣醫事檢驗產業工會,吳進興,110,臺北市信義區光復南路495號4樓,
643,產業工會,台灣非營利組織產業工會,周于萱,106,臺北市大安區泰順街26巷39號2樓,
644,產業工會,中華翻譯出版產業工會,張高維,104,臺北市中山區中山北路3段29號5樓之3,
645,產業工會,中華影視編劇產業工會,陳星宇,251,新北市淡水區學府路102巷62-2號5樓   去電無人接聽,(02)25928612
646,產業工會,台灣麻醉醫療產業工會,儲寧瑋,100,臺北市中正區紹興北街35號4樓之1,
647,產業工會,全國交通運輸產業工會,顏坤泉,116,臺北市文山區景興路206號4樓之1,
648,產業工會,中華民國租賃住宅服務業產業工會,趙元瑞,100,臺北市中正區忠孝東路1段76號3樓之4,
649,產業工會,中華直銷從業人員產業工會,阮錦威,100,臺北市中正區重慶南路1段10號9樓901室,
650,產業工會,臺北市美食外送產業工會,陳泓瑞,114,臺北市內湖區成功路四段61巷8弄6號地下樓,(02)23611800
651,產業工會,台灣金融服務業產業工會,蔡元鎮,100,臺北市中正區重慶南路1段2號2樓,
652,產業工會,臺北市多元化計程車產業工會,胡偉成,100,臺北市中正區南海路124-1號,(02)25119231
653,產業工會,臺灣數位平台預約接送從業人員產業工會,李威爾,244,新北市林口區寶林路99號,
654,產業工會,臺灣金融勞權產業工會,林御風,247,新北市蘆洲區中央路171號11樓,(02)25232708
655,產業工會,全國議會民代助理產業工會,吳香君,110,臺北市信義區仁愛路四段507號6樓605室,
656,產業工會,臺北市裝飾藝術文創產業工會,陳品蒨,111,臺北市士林區中山北路六段200號2樓,
657,產業工會,臺北市搬運業產業工會,張家瑋,108,臺北市萬華區萬大路322巷20號1樓,
658,產業工會,臺北市臺灣空間規劃設計產業工會,郭孟瑜,100,臺北市杭南郵局第631號信箱,
659,產業工會,臺灣夜市商圈產業工會(臺北市),林定國,103,臺北市大同區延平北路２段34號,
660,產業工會,臺北市全國營造建築土木產業工會,邱寶安,108,台北市萬華區桂林路157號1樓,(02)29210625
661,產業工會,臺北市台灣環境生態護育產業工會,何承翰,"	106",臺北市大安區溫州街74巷14號1樓,(02)23821688
662,產業工會,臺北市全國外送產業工會,陳昱安,108,臺北市萬華區萬大路184號2樓,(02)86668111
663,產業工會,臺北市全國計程車駕駛產業工會,江信翰,236,新北市土城區青仁路 29 號 9 樓,
664,產業工會,臺北市全國網路自媒體產業工會,郭國花,104,臺北市中山區中山北路一段11號9樓,
665,產業工會,臺北市公立幼兒園廚工產業工會,傅玉如,103,臺北市大同區重慶北路３段224號1樓,
666,產業工會,台灣電子電機資訊產業工會,洪碧雲,108,臺北市萬華區萬大路184號2樓,
667,產業工會,臺北市攤商業產業工會,黃佳鈺,108,臺北市萬華區民和街25號3樓,(02)23055731
668,產業工會,臺北市數位自媒體科技產業工會,黃瀧陞,100,臺北市中正區青島東路4號2樓之1,(02)23587688
669,產業工會,臺北市人工智慧產業工會,呂鴻烈,104,臺北市中山區南京東路二段101號9樓,
670,產業工會,台灣呼吸治療產業工會,周育正,108,臺北市萬華區萬大路184號2樓,
671,產業工會,臺北市人工智慧直播電商產業工會,劉姿瑩,114,臺北市內湖區洲子街105號6樓,
672,產業工會,台灣人力資源永續學習發展產業工會,盧世安,100,臺北市中正區林森南路142號B1,
673,工會聯合組織,臺北市總工會,林國成,104,臺北市中山區中山北路2段71號7樓,(02)25605555
674,工會聯合組織,台北市職業總工會,鄭力嘉,114,臺北市內湖區舊宗路二段181巷10號,(02)28105510
675,工會聯合組織,臺北市產業總工會,邱奕淦,108,臺北市萬華區萬大路184號2樓,(02)23396172
676,工會聯合組織,臺北市金屬業產業工會聯合會,高俊寬,103,臺北市大同區重慶北路3段347號3樓之2(被退件),(02)25973456
677,工會聯合組織,臺北市紡織染整業產業工會聯合會,何宇文,112,臺北市北投區大興街23巷7號3樓,
678,工會聯合組織,臺北市聯營公車企業工會聯合會,鄧有明,100,臺北市中正區汀州路3段56號B1,(02)23684067
679,工會聯合組織,臺北市菸酒業產業工會聯合會,趙銘圓,104,臺北市中山區八德路2段85號,(02)89651858
680,工會聯合組織,臺北市公務機關總工會,謝嘉茹,103,臺北市大同區昌吉街55號2樓215-216室,(02)25972631
681,工會聯合組織,台北市產職業總工會,曹莉,104,臺北市中山區復興北路62號3樓之2,(02)25151580
682,工會聯合組織,臺北市產職企業總工會,王覺毅,100,臺北市中正區愛國西路9號6樓之2,(02)23832885
683,工會聯合組織,雙北市產業總工會,盧峰毅,973,花蓮縣吉安鄉東里一街156號,(03)8460768
684,工會聯合組織,雙北市職業總工會,黃桂蘭,100,臺北市中正區愛國西路9號4樓之7,(02)23887188
685,工會聯合組織,雙北市總工會,陳桓浩,104,臺北市中山區復興北路62號3樓之2,(02)25151580
686,工會聯合組織,北北基影視流行音樂總工會,陳桓浩,104,臺北市中山區復興北路62號3樓之2,(02)25151580
687,工會聯合組織,大臺北總工會,林政良,100,臺北市中正區愛國西路9號4樓之6,(02)23887188
688,工會聯合組織,大臺北職業總工會,林政良,100,臺北市中正區愛國西路9號4樓之7,(02)23887188
689,工會聯合組織,大臺北產業總工會,張重光,100,臺北市中正區愛國西路9號4樓之9,(02)23144996
690,工會聯合組織,台北市觀光旅遊業工會聯合會,馬潮,104,臺北市中山區林森北路289號7樓702室,(02)25415522
691,工會聯合組織,北臺灣總工會,謝炳山,100,臺北市中正區金山南路一段108號7樓之3,(02)23751655
692,工會聯合組織,台北市勞工總工會,宋細英,100,臺北市中正區羅斯福路2段7之6號9樓,(02)23510823
693,工會聯合組織,台北市工人總工會,張惟皓,108,臺北市萬華區中華路1段182號,(02)23703399
694,工會聯合組織,市縣政府機關環保工會聯合會,李文福,100,臺北市中正區懷寧街58號3樓,
695,工會聯合組織,北台灣汽車客運業工會聯合會,高令國,100,臺北市中正區汀州路3段56號B1,(02)23684067
696,工會聯合組織,台北企業總工會,王裕文,104,臺北市中山區中山北路2段48巷7號4樓,(02)25363001
697,工會聯合組織,台灣勞工總工會,王裕文,104,臺北市中山區中山北路2段48巷7號4樓,(02)25363001
698,工會聯合組織,臺北市工會團體總工會,鄭火賜,114,臺北市內湖區舊宗路二段181巷10號,(02)28105510
699,工會聯合組織,大臺北產職業聯合總工會,廖年豐,104,臺北市中山區民權西路20號5樓之12,(02)25319033
700,工會聯合組織,中華勞工同盟總工會,張高維,104,臺北市中山區中山北路三段29號5樓之2,(02)25959340
701,工會聯合組織,中華職工總工會,吳權鴻,100,臺北市中正區忠孝西路一段41號11樓之11,(02)23756788
702,工會聯合組織,臺北市政府所轄企業工會聯合會,楊振德,100,臺北市中正區懷寧街58號4樓,(02)23318675
