項次,工會屬性,工會名稱,理事長,郵遞區號,通訊地址,聯絡電話
402,企業工會,台北市欣欣客運股份有限公司企業工會,伍開勳,100,臺北市中正區汀州路3段56號B1,(02)23684067
403,企業工會,臺北市德信海空運承攬股份有限公司產業工會,0,104,臺北市中山區南京東路3段219號4樓,(02)27130421
404,企業工會,臺北市指南汽車客運股份有限公司產業工會,謝章耀,111,臺北市士林區中正路499號2樓,
405,企業工會,崇友實業股份有限公司企業工會,孫志維,247,新北市蘆洲區中山二路176號1樓,(02)22835522
406,企業工會,臺北市台灣快桅股份有限公司企業工會,高瑞憶,115,臺北市南港區市民大道七段8號13樓,(02)27750550
407,企業工會,臺北市中興大業巴士股份有限公司企業工會,陳志傑,111,臺北市士林區中正路499號,(02)28826780
408,企業工會,臺北市國華產物保險股份有限公司產業工會,蔣晉暘,104,臺北市中山區長安東路2段166號,
409,企業工會,新加坡商新加坡航空股份有限公司台灣分公司企業工會,鄒忠邦,104,臺北市中山區松江路148號2樓,(02)25228639
410,企業工會,臺北市榮電股份有限公司產業工會,趙旭東,116,臺北市羅斯福路6段107號1樓,(02)89195168
411,企業工會,臺北市中國信託商業銀行股份有限公司產業工會,簡文哲,110,"臺北市信義區松壽路3號16樓
(1091111無法投遞被退件)",(02)27222002
412,企業工會,臺北市中國信託商業銀行股份有限公司城中分公司產業工會,劉永光,100,臺北市中正區重慶南路1段83號,(02)23818740
413,企業工會,臺北市陸海股份有限公司產業工會,鄧慶豪,206,基隆市七堵區大德路3之1號,(02)24515208
414,企業工會,臺灣證券交易所股份有限公司企業工會,吳家傳,110,臺北市信義區信義路5段7號9樓,(02)81013830
415,企業工會,臺灣菸酒股份有限公司工會,侯佳雄,100,臺北市中正區南昌路1段4號1樓,(02)23214567
416,企業工會,臺灣土地銀行企業工會,林佳慶,100,臺北市中正區懷寧街53號9樓,(02)23483692
417,企業工會,臺北市臺灣美國運通國際股份有限公司產業工會,"許惠娜
朱力行
宿玉潔",105,臺北市松山區復興北路363號12樓,(02)27178737
418,企業工會,臺北市聯合晚報股份有限公司產業工會,"高?垚
陳永富
彭志偉 ",110,"臺北市信義區基隆路1段180號7樓
(1091111無法投遞被退件)",(02)27634300
419,企業工會,臺北農產運銷股份有限公司企業工會,盧建中,108,臺北市萬華區萬大路533號2樓,(02)25162519
420,企業工會,潤泰創新國際股份有限公司企業工會,蔡順發,104,臺北市中山區八德路2段308號11樓,(02)81619888
421,企業工會,臺北市財團法人國語日報社工會,王福鈞,100,臺北市中正區福州街10號4樓,(02)23921133
422,企業工會,臺灣肥料股份有限公司企業工會,黃韋晨,104,臺北市中山區南京東路2段88號6樓,(02)25422231
423,企業工會,臺北大眾捷運股份有限公司企業工會,簡宗宏,104,臺北市中山區中山北路2段48巷7號4樓,(02)25363001
424,企業工會,財團法人中央通訊社工會,馮昭,104,臺北市中山區松江路209號,(02)25051180
425,企業工會,台灣三菱電梯股份有限公司企業工會,阮立榮,106,臺北市大安區復興南路2段363號,(02)27335353
426,企業工會,臺北市臺灣杜邦股份有限公司產業工會,徐啟洲,105,臺北市松山區敦化北路167號13樓,(02)27191999
427,企業工會,第一商業銀行股份有限公司工會,陳正雄 ,100,臺北市中正區重慶南路1段30號21樓,(02)23481951
428,企業工會,台北富邦商業銀行股份有限公司企業工會,曹德俊,112,臺北市北投區中央北路1段2號4樓,(02)28926597
429,企業工會,臺北市益華股份有限公司產業工會,曾敬業,105,臺北市松山區復興北路57號14樓,(02)27698250
430,企業工會,大台北區瓦斯股份有限公司企業工會,許呈?,105,臺北市松山區光復北路11巷33號1樓,(02)27471806
431,企業工會,臺北市陽明山瓦斯股份有限公司產業工會,0,111,臺北市士林區葫蘆街61巷9號,(02)28948686
432,企業工會,合作金庫商業銀行股份有限公司企業工會,陳金渠,100,臺北市中正區南陽街62號,(02)25568252
433,企業工會,臺灣銀行股份有限公司企業工會,陳俊雄,100,臺北市中正區寶慶路35號4樓,(02)23493938
434,企業工會,臺灣中小企業銀行股份有限公司企業工會,游宏生,106,臺北市大安區仁愛路4段357號,(02)27732788
435,企業工會,兆豐國際商業銀行股份有限公司工會,郭孟仁,104,臺北市中山區南京東路2段53號8樓,(02)25625559
436,企業工會,臺北市美國聯合航空股份有限公司臺灣分公司產業工會 ,"張錦昌
楊英儀
莊育鉅",114,臺北市內湖區大湖山莊街202巷15號3樓,(02)27942986
437,企業工會,中國石油化學工業開發股份有限公司企業工會,楊明璋,105,臺北市松山區東興路12號11樓,(02)87878322
438,企業工會,臺北市停車管理工程處企業工會,朱世梓,105,臺北市松山區八德路4段181巷22號1樓,(02)27471250
439,企業工會,臺北市法國興業銀行股份有限公司產業工會,孫一德,105,"臺北市松山區民生東路3段109號7樓
(1091108無法投遞被退件)",(02)21750000
440,企業工會,臺北市中國輸出入銀行企業工會,王玉晴,100,臺北市中正區南海路3號8樓,(02)23210511
441,企業工會,中央存款保險股份有限公司企業工會,齊偉,100,臺北市中正區南海路3號11樓,(02)23971155
442,企業工會,彰化商業銀行股份有限公司企業工會,黃國棟,100,臺北市中正區衡陽路68號4樓,(02)23148155
443,企業工會,臺北市南山人壽保險股份有限公司企業工會,蔡坤穎,104,臺北市中山區民權西路20號3樓之2,(02)25603255
444,企業工會,臺北市中國人壽保險股份有限公司產業工會,洪文良,105,臺北市松山區敦化北路122號5樓,(02)27177388
445,企業工會,臺北市財團法人中央廣播電臺企業工會,岳昭莒,104,臺北市中山區北安路55號,(02)28856168
446,企業工會,民間全民電視股份有限公司企業工會,張雅晴,244,新北市林口區信義路99號9樓,(02)25702570
447,企業工會,台北市政府環境保護局企業工會,蔣萬金,108,臺北市萬華區東園街19號9樓,(02)23055729
448,企業工會,臺北市瑞興商業銀行股份有限公司企業工會,胡偉民,103,臺北市大同區延平北路2段133號,(02)25575151
449,企業工會,財團法人公共電視文化事業基金會企業工會,張世傑,114,臺北市內湖區康寧路3段75巷50號9樓,(02)26301192
450,企業工會,臺北市國家音樂廳交響樂團產業工會,"朱偉誼
鍾仁甫
宋光清",100,臺北市中正區中山南路21之1號,(02)33939888
451,企業工會,臺北市政府工務局水利工程處企業工會,陳宜賢,114,臺北市內湖區潭美街183號,
452,企業工會,臺北市國立實驗國樂團產業工會,"王琇媜
陳思予
劉    治",100,臺北市中正區中山南路21之1號(查無退件110.01.08),(02)23435252
453,企業工會,新光人壽保險股份有限公司企業工會,詹素霞,103,臺北市大同區西寧北路78號9樓905室,(02)25509149
454,企業工會,中央健康保險署工會,葉長楨,801,高雄市前金區中正四路259號8樓資訊室,
455,企業工會,臺北市臺北漁產運銷股份有限公司企業工會,李玉程,108,臺北市萬華區萬大路531號3樓,(02)23037635
456,企業工會,勞動部勞工保險局工會,陳銅山,100,臺北市中正區羅斯福路1段4號10樓,(02)23219381
457,企業工會,文化部工會,謝嘉茹,103,臺北市大同區昌吉街55號2樓215-216室,(02)25972631
458,企業工會,中國國民黨企業工會,伍康龍,104,臺北市中山區八德路2段232號B1,(02)21731256
459,企業工會,臺北市寒舍餐旅管理顧問股份有限公司產業工會,"林李祥
朱吉安",100,臺北市中正區忠孝東路一段12號B3,
460,企業工會,國立政治大學工會,莊馥維,116,臺北市文山區指南路2段64號,(02)29393091
461,企業工會,泰商泰國航空國際有限公司企業工會,張文玉,104,臺北市中山區松江路223號7樓,(02)25151888
462,企業工會,富邦人壽保險股份有限公司工會,闕念祖,105,臺北市松山區八德路3段20號8樓D-1區,(02)25792624
463,企業工會,臺北市政府工務局衛生下水道工程處企業工會,周盛發,103,"臺北市大同區酒泉街235號(後棟四樓)
寄:台北市內湖區舊宗路二段2號",(02)87911254
464,企業工會,台北市台灣武田藥品工業股份有限公司企業工會,陳炳華 ,110,臺北市信義區松高路1號17樓,(02)87099050
465,企業工會,永豐商業銀行股份有限公司企業工會,張麗澤,104,臺北市中山區建國北路2段3巷2號5樓,(02)25189388
466,企業工會,華南金融控股股份有限公司與子公司企業工會,李輝明,100,臺北市中正區重慶南路1段38號2樓,(02)23122201
467,企業工會,臺北市國際合作發展基金會產業工會,高鷗,111,臺北市士林區天母西路62巷9號12樓,(02)28732323
468,企業工會,兆豐金融控股股份有限公司與子公司工會,吳世哲,100,臺北市中正區重慶南路1段2號2樓,(02)23710728
469,企業工會,臺北市國立戲曲專科學校附設國劇團產業工會,趙延強,114,臺北市內湖區內湖路2段177號,
470,企業工會,臺北市玉山商業銀行股份有限公司企業工會,黃衛聖,105,臺北市松山區民生東路3段115、117號,(02)21751313
471,企業工會,華信航空企業工會,沈耿堯,105,臺北郵局第45-62號信箱,(02)27171188
472,企業工會,台灣糖業股份有限公司台北市企業工會,黃榮彬,108,臺北市萬華區艋舺大道297號2樓,(02)23061112
473,企業工會,大都會汽車客運股份有限公司企業工會,李治緯,114,臺北市內湖區民權東路6段11巷6號2樓,(02)27968446
474,企業工會,第一金融控股股份有限公司與子公司企業工會,胡淋森,100,臺北市中正區重慶南路1段30號21樓,(02)23484695
475,企業工會,明台產物保險股份有限公司企業工會,陳世傑,106,北市中正區仁愛路2段22號3樓,(02)27725678
476,企業工會,臺北市東和鋼鐵企業股份有限公司企業工會,賴偉廉,104,臺北市中山區長安東路1段9號6樓,(02)25511100
477,企業工會,臺北市中央電影事業股份有限公司產業工會,"李祖怡
高瑞青
阮崧卿",108,臺北市萬華區漢中街116號6樓,(02)27781058
478,企業工會,聯捷運輸股份有限公司企業工會,張裕源,815,高雄市大社區旗楠路62號,(07)8714316
479,企業工會,臺北市永豐金證券股份有限公司企業工會,吳明哲,104,臺北市中山區建國北路2段3巷2號7樓,(02)23823467
480,企業工會,臺北市政府工務局公園路燈工程管理處企業工會,楊振德(代理),100,臺北市中正區懷寧街58號3樓,(02)23318675
481,企業工會,臺北市政府工務局新建工程處企業工會,徐清文,104,臺北市中山區新生北路2段78號,(02)25235227
482,企業工會,臺北市臺灣開利股份有限公司產業工會,游典儒,116,臺北市文山區育英街17巷5弄8號3樓,
483,企業工會,凱基商業銀行股份有限公司企業工會,蔡鴻儒,103,臺北市大同區長安西路106號10樓之2,(02)25592370
484,企業工會,臺北市亞太電信股份有限公司企業工會,許文宏,114,臺北市內湖區基湖路32號,(02)55558888
485,企業工會,安泰商業銀行股份有限公司企業工會,陳嘉欽,116,臺北市文山區興隆路三段11號4樓,(02)29341853
486,企業工會,台北市南山產物保險股份有限公司企業工會,金文華,100,臺北市中正區忠孝西路1段6號17樓,(02)77268706
487,企業工會,財團法人法律扶助基金會工會,許俊銘,106,臺北市大安區金山南路2段200號5樓,(02)23225255
488,企業工會,臺北市香港商香港上海?豐銀行股份有限公司產業工會,阮幼婷,100,臺北市中正區中華路2段498巷1號11樓,(02)26527000
489,企業工會,陽信商業銀行股份有限公司企業工會,陳炳宏,112,臺北市北投區石牌路1段88號7樓,(02)28362072
490,企業工會,台灣世曦工程顧問股份有限公司企業工會,林志權,114,臺北市內湖區陽光街323號5樓,(02)87973567
491,企業工會,台灣富士軟片資訊股份有限公司企業工會,李富山,334,桃園市八德區介壽路一段199號3樓,(02)27711760
492,企業工會,臺北市中華快遞股份有限公司企業工會,郭榕燁,104,臺北市中山區民生西路3巷9號,(02)25603778
493,企業工會,臺銀人壽保險股份有限公司企業工會,錢熙嘉,106,臺北市大安區敦化南路2段69號2樓,(02)27849151
494,企業工會,臺銀綜合證券股份有限公司企業工會,曾鳳貞,100,臺北市中正區重慶南路1段58號8樓,(02)23882188
495,企業工會,中華工程股份有限公司工會,陳宗坤,105,臺北市松山區東興路12號6樓,(02)87876205
496,企業工會,臺北市台証綜合證券股份有限公司產業工會,魏德揚,104,臺北市中山區建國北路2段3巷2號5樓,(02)27553327
497,企業工會,臺北市凱基證券股份有限公司企業工會,苗致偉,104,臺北市中山區明水路700號,(02)21818282
498,企業工會,台灣丹馬士環球物流股份有限公司工會,鄭華,115,臺北市南港區市民大道7段8號13樓之3,(02)26523230
499,企業工會,?豐(台灣)商業銀行股份有限公司企業工會 ,陳世雄,115,臺北市南港區忠孝東路7段369號15樓,(02)66312109
500,企業工會,財團法人中小企業信用保證基金工會,顏國裕,100,臺北市中正區羅斯福路1段6號4樓,(02)23214261
501,企業工會,大同綜合訊電股份有限公司企業工會,吳信豪,104,臺北市中山區中山北路3段22號3樓,(02)25925252
502,企業工會,富邦金融控股公司集團工會,吳曉文,112,臺北市北投區東華街2段294號1樓,(02)28227711
503,企業工會,臺灣金控集團企業工會,阮呂文欽,103,臺北市大同區承德路二段208號7樓,(02)85905947
504,企業工會,聯華氣體工業股份有限公司企業工會,吳玲兒,115,臺北市南港區南港路1段209號A棟8樓,
505,企業工會,台灣本田股份有限公司企業工會,林正凱,104,臺北市中山區民生東路3段69號13樓,(02)25066268
506,企業工會,台灣諾華股份有限公司企業工會,陳自力,104,臺北市中山區民生東路三段2號8樓,(02)23227777
507,企業工會,潤弘精密工程事業股份有限公司企業工會,劉士祺,104,臺北市中山區八德路2段308號10樓,(02)81619999
508,企業工會,合作金庫金融控股股份有限公司暨其子公司企業工會,張資盟,100,臺北市中正區南陽街62號,(02)25568252
509,企業工會,潤泰精密材料股份有限公司企業工會,林弘偉,104,臺北市中山區八德路2段308號10樓,(03)9596989
510,企業工會,中國青年救國團企業工會,陳建成,104,臺北市中山區民權東路2段69號,(02)25965858
511,企業工會,臺灣航勤股份有限公司企業工會,林宏河,105,臺北郵政45之10號,(02)27152811
512,企業工會,中華電信股份有限公司關係企業工會,杜桂梅,106,臺北市大安區金華街138號2樓,(02)23411799
513,企業工會,壹傳媒電視廣播股份有限公司企業工會,高培騰,114,臺北市內湖區行愛路141巷48號4樓,
514,企業工會,台北市元大人壽保險股份有限公司企業工會,張艷秋,105,臺北市松山區民生東路3段156號16樓C戶,
515,企業工會,國立臺灣大學工會,翁小雯,106,"臺北市中正區羅斯福路4段64-1號
臺北公館郵局第13-148號",(02)27183979
516,企業工會,中華電信股份有限公司個人家庭分公司企業工會,蘇弘廷,100,臺北市中正區仁愛路1段42號7樓715室,
517,企業工會,中華電信股份有限公司網路技術分公司企業工會,洪秀龍,106,臺北市大安區愛國東路35號B1樓,(02)23975666
518,企業工會,上海商業儲蓄銀行股份有限公司企業工會,黃有材,104,臺北市中山區中山北路二段96號3F,(02)33166919
519,企業工會,宏華國際股份有限公司企業工會,呂仲明,220,新北市板橋區民族路168號,(02)25817111
520,企業工會,台灣三菱商事股份有限公司工會,蔡孟志,104,臺北市中山區松江路87號14樓,(02)29560997
521,企業工會,臺北市財團法人原住民族文化事業基金會企業工會,林姿君,115,臺北市南港區重陽路120號5樓,(02)25089151
522,企業工會,中華開發金融控股股份有限公司與子公司企業工會,苗致偉,105,臺北市松山區南京東路5段125號6樓,(02)25770151
523,企業工會,台灣高速鐵路股份有限公司企業工會,陳堯森,115,臺北市南港區忠孝東路七段518號9樓,(02)77131473
524,企業工會,中華電信股份有限公司資訊技術分公司企業工會,劉必賢,100,臺北市中正區信義路1段21號數據大樓309室,
525,企業工會,中華電信股份有限公司企業客戶分公司企業工會,張李武炎,106,臺北市大安區信義路4段88號1801室,(02)23432004
526,企業工會,國家表演藝術中心企業工會,陳喬如,108,臺北市萬華區西藏路111號6樓之1,(02)23266805
527,企業工會,永豐金融控股股份有限公司暨子公司企業工會,鍾馥吉,103,臺北市大同區民生西路286號2樓,
528,企業工會,兆豐金融控股股份有限公司企業工會,羅育祥,100,臺北市中正區忠孝東路2段123號14樓,(02)25500333
529,企業工會,尹書田醫療財團法人書田泌尿科眼科診所企業工會,許耀文,106,臺北市大安區建國南路2段276號,(02)23578888
530,企業工會,東森電視事業股份有限公司企業工會,鄭鴻昇,100,臺北市中正區忠孝西路1段4號12樓,
531,企業工會,潤福生活事業股份有限公司企業工會,張鈞池,104,臺北市中山區八德路2段308號11樓之1,
532,企業工會,潤泰保全股份有限公司企業工會,葉柏琪(代理),104,臺北市中山區八德路2段308號11樓之1,(02)26299000
533,企業工會,潤德室內裝修設計工程股份有限公司企業工會,許茲榮,104,臺北市中山區八德路2段308號11樓之1,(02)81619815
534,企業工會,潤泰公寓大廈管理維護股份有限公司企業工會,侯羲陛,104,臺北市中山區八德路2段308號11樓之1,(02)81619800
535,企業工會,自由時報企業股份有限公司工會,吳亮儀,108,臺北市萬華區萬大路184號2樓,(02)81619815
536,企業工會,國家表演藝術中心國家兩廳院企業工會,"李惟綱
(淡成偉代行1年1110322)",105,臺北市信義區松山路515巷2弄14號2樓,
537,企業工會,荷商葛蘭素史克藥廠股份有限公司台灣分公司工會,黃治程,338,桃園市蘆竹區南祥路370號11樓,
538,企業工會,合作金庫證券股份有限公司企業工會,王麗秋,403,臺中市西區民權路91號6樓,
539,企業工會,中華電信股份有限公司國際電信分公司企業工會,林朝贊,106,臺北市大安區愛國東路31號,
540,企業工會,臺北市立聯合醫院企業工會,郭蕢瑩,108,臺北市萬華區萬大路184號2樓,
541,企業工會,財團法人中華民國對外貿易發展協會企業工會,洪仁杰,115,臺北市南港區經貿二路1號,
542,企業工會,三立電視股份有限公司工會,林敬旻,108,臺北市萬華區萬大路184號2樓,(02)27255200
543,企業工會,全球人壽保險股份有限公司企業工會,張業宇,104,臺北市中山區民權西路20號3樓之2,
544,企業工會,立榮航空股份有限公司企業工會,李鳳恩,104,臺北市中山區長安東路2段117號8樓,
545,企業工會,兆豐產物保險股份有限公司企業工會,張水駱,100,臺北市中正區重慶南路1段2號2樓,
546,企業工會,兆豐證券股份有限公司企業工會,王凱,116,臺北市文山區景中街1號3樓,
547,企業工會,全聯實業股份有限公司企業工會,朱鴻國,104,臺北市中山區敬業四路33號,
548,企業工會,元大商業銀行股份有限公司企業工會,王復德,103,臺北市大同區承德路3段210號,
549,企業工會,嘉里大榮物流股份有限公司企業工會,簡廷偉,100,臺北市中正區新生南路1段50號14樓,(02)21821977
550,企業工會,嘉里大榮物流股份有限公司關係企業工會,簡廷偉,100,臺北市中正區新生南路一段50號14樓,
551,企業工會,國立臺灣大學醫學院附設醫院企業工會,楊心慧,106,臺北市大安區泰順街26巷39號2樓,
552,企業工會,星宇航空股份有限公司企業工會,黃守儀,114,臺北市內湖區南京東路六段382號,
553,企業工會,台灣必治妥施貴寶股份有限公司企業工會,王淑芬,105,臺北市松山區健康路156號5樓,(02)27911000
554,企業工會,統一超商股份有限公司關係企業工會,孫杰,110,臺北市信義區東興路65號2樓,
555,企業工會,振興醫療財團法人企業工會,王曉暹,112,臺北市北投區振興街45號,
556,企業工會,台灣基督長老教會馬偕醫療財團法人企業工會,臧汝芬,104,臺北市中山區中山北路2段92號,(02)28264400
557,企業工會,遠雄人壽保險事業股份有限公司企業工會,吳添城,103,臺北市大同區西寧北路78號9樓905室,
558,企業工會,統一超商股份有限公司企業工會,謝佳雯,110,臺北市南港區東新街128號7樓,(02)25509149
559,企業工會,台北世界貿易中心股份有限公司企業工會,馬麗,110,臺北市信義區信義路五段五號6樓6C-11室,
560,企業工會,臺北市長汎旅行社股份有限公司企業工會,徐碩宏,104,臺北市中山區長安東路二段100號3樓,
561,企業工會,統一生活事業股份有限公司企業工會,李淑惠,114,臺北市內湖區內湖路1段120巷15弄25號4樓,(02)25132929
562,企業工會,悠旅生活事業股份有限公司企業工會,李秉宏,106,臺北市大安區瑞安街142巷5號4樓,
563,企業工會,臺北市立動物園企業工會,蔡鴻志,116,臺北市文山區新光路２段30號,
564,企業工會,臺北市家福股份有限公司關係企業工會,籃世華,108,臺北市萬華區萬大路184號2樓,
565,企業工會,臺北市交通部民用航空局企業工會,吳子豪,105,臺北市松山區敦化北路340號,
566,企業工會,臺灣集中保管結算所股份有限公司企業工會,林宏昇,105,臺北市松山區復興北路363號9樓,
567,企業工會,華碩電腦股份有限公司企業工會,黃冠雄,112,臺北市北投區光明路226號3樓之3,
568,企業工會,第一金證券股份有限公司企業工會,王永慶,100,臺北市中正區延平南路38號5樓,
569,企業工會,星展(台灣)商業銀行股份有限公司企業工會,廖重一,220,新北市板橋區文化路二段430號4樓之5,
570,企業工會,合作金庫證券投資信託股份有限公司工會,戴瑛佑,104,台北市中山區南京東路二段85號13樓,
571,企業工會,臺北市陳章安聯合建築師事務所企業工會,黃瀧陞,106,臺北市大安區敦化北路二段168號4樓,
572,企業工會,美商甲骨文有限公司台灣分公司企業工會,陳德旭,108,臺北市萬華區萬大路184號2樓,
573,企業工會,國泰人壽保險股份有限公司企業工會,鄭光暉,103,臺北市大同區涼州街2號3樓之15,
574,企業工會,國泰世華銀行股份有限公司企業工會,陳章銘,100,台北市中正區開封街1段37號5樓,(02)8979-7698
575,企業工會,新光醫療財團法人新光吳火獅紀念醫院企業工會,施駿沁,111,台北市士林區文昌路95號(急診室),(02)28332211
576,企業工會,國泰世紀產物保險股份有限公司企業工會,藍尉倫,106,台北市大安區仁愛路4段296號7樓,
577,企業工會,國泰金融控股股份有限公司企業工會,童桂珍,106,台北市大安區忠孝東路4段270號2樓之1,
578,企業工會,臺灣新光商業銀行股份有限公司企業工會,李孟庭,111,台北市士林區德行東路37號3樓,
579,企業工會,臺北市國泰證券投資信託股份有限公司企業工會,高大程,106,臺北市大安區敦化南路二段39號3樓,
580,企業工會,元富證券股份有限公司企業工會,劉永豐,807,高雄市三民區博愛一路391號8樓,(02)272008399
581,企業工會,台灣水泥股份有限公司企業工會,劉國弘,116,台北市羅斯福路6段378號12樓,
582,企業工會,臺北榮民總醫院企業工會,黃甘迪,111,臺北市士林區中山北路六段13號12樓之3,
583,企業工會,賽諾菲股份有限公司企業工會,林敬翔,105,臺北市松山區八德路三段186號6樓之12,
584,企業工會,國立臺灣大學醫學院附設醫院癌醫中心分院企業工會,許銘修,235,新北市中和區中和路316號13樓之3,
585,企業工會,中華電信股份有限公司網路技術分公司行動北區營運處企業工會 ,洪秀龍,106,臺北市大安區愛國東路35號B1,
586,企業工會,酷澎通運股份有限公司企業工會,甘聖麒,104,臺北市中山區吉林路200巷16號,
587,產業工會,臺北市網路購物產業工會,饒卿凱,100,臺北市中正區愛國西路9號4樓之8,
588,產業工會,臺北市文化創意產業工會,林政良,100,臺北市中正區愛國西路9號4樓之7,(02)23144996
589,產業工會,臺北市鐘錶產業工會,饒卿凱,100,臺北市中正區愛國西路9號4樓之8,(02)23144996
590,產業工會,臺北市驗光配鏡產業工會,林政良,100,臺北市中正區愛國西路9號4樓之8,(02)23144996
591,產業工會,臺北市眼鏡產業工會,黃桂蘭,100,臺北市中正區愛國西路9號4樓之8,(02)23144996
592,產業工會,臺北市徵信產業工會,張重光,100,臺北市中正區愛國西路9號4樓之8,(02)23144996
