項次,工會屬性,工會名稱,理事長,郵遞區號,通訊地址,聯絡電話
205,職業工會,臺北市陸上運輸服務人員職業工會,陳育材,112,臺北市北投區文林北路234之3號1樓,(02)28212687
206,職業工會,臺北市彩券販賣人員職業工會,姜村隆,104,臺北市中山區民權東路1段12巷7號,(02)25812807
207,職業工會,臺北市仲介業職業工會,陳牧玄,104,臺北市中山區民權東路2段206號7樓,(02)25182896
208,職業工會,臺北市電腦工程業職業工會,鄭昕昀,112,臺北市北投區東華街2段212號,(02)28281444
209,職業工會,臺北市機師職業工會,李冠宇,105,臺北市松山區民權東路3段142號8樓805室,(02)27169810
210,職業工會,臺北市青草藥製造職業工會,陳仁章,108,臺北市萬華區東園街28巷50之11號,(02)23377042
211,職業工會,臺北市幼兒托育職業工會,董育晴,116,臺北市文山區景華街21號1樓,(02)29350559
212,職業工會,臺北市通信服務人員職業工會,廖年豐,104,臺北市中山區民權西路20號5樓之12,(02)25214525
213,職業工會,臺北市陰陽宅設計職業工會,廖年茂,104,臺北市中山區民權西路20號5樓之12,(02)25214525
214,職業工會,臺北市推銷員職業工會,林靜榆,116,臺北市文山區景華街21號1樓,(02)29350559
215,職業工會,臺北市租賃小客車駕駛員職業工會,簡哲賢,103,臺北市大同區承德路3段86號3樓(非工會地址，請勿寄送),(02)25948608
216,職業工會,臺北市人民團體聘僱人員職業工會,孫瑞蓮,235,新北市中和區景平路140號3樓,(02)22398872
217,職業工會,台北市社區環境服務人員職業工會,林恩豪,104,台北市中山區民生東路一段 54 號 11 樓,(02)25634456
218,職業工會,臺北市商店售貨業職業工會,孫荷芳,108,臺北市萬華區萬大路548號,(02)23375719
219,職業工會,臺北市茶業包裝加工業職業工會,陳阿雀,100,臺北市中正區和平西路1段84號2樓,(02)23697688
220,職業工會,臺北市中餐服務人員職業工會,盧錦桃,100,臺北市中正區愛國西路9號4樓之2,(02)27961234
221,職業工會,臺北市西餐服務人員職業工會,余財發,100,臺北市中正區愛國西路9號4樓之2,(02)27961234
222,職業工會,臺北市外燴服務人員職業工會,,100,臺北市中正區愛國西路9號4樓之2,(02)27961234
223,職業工會,臺北市模具製作工職業工會,周敦瑛,108,臺北市萬華區莒光路130號4樓,(02)23380960
224,職業工會,臺北市翻譯業職業工會,張佑瑋,104,臺北市中山區中山北路3段29號5樓之3,(02)25928612
225,職業工會,臺北市話務人員職業工會,洪文煙,103,臺北市大同區民族西路303巷37號1樓,(02)25353536
226,職業工會,臺北市直銷人員職業工會,林恩新,104,台北市中山區民生東路一段 54 號 11 樓,(02)25673302
227,職業工會,臺北市才藝教學服務人員職業工會,潘敏媛,108,臺北市萬華區中華路1段182號1樓,(02)23213799
228,職業工會,臺北市電腦文書處理人員職業工會,高殷傑,104,臺北市中山區長春路26號8樓之3,(02)25119857
229,職業工會,臺北市汽車洗車工職業工會,陳慶鴻,103,臺北市大同區長安西路205號2樓之3,(02)25559541
230,職業工會,臺北市農產品運送業職業工會,潘明娟,108,臺北市萬華區中華路1段182號1樓,(02)23703399
231,職業工會,臺北市網路咖啡服務業職業工會,張華棈,108,臺北市萬華區中華路1段182號1樓,(02)23213799
232,職業工會,臺北市個人計程車駕駛員職業工會,阮志雄,104,臺北市中山區民族東路63-1號,(02)25170465
233,職業工會,臺北市保險業務職業工會,張煒如,108,臺北市萬華區中華路1段182號1樓,(02)23213799
234,職業工會,臺北市網路購物服務人員職業工會,林政良,100,臺北市中正區愛國西路9號4樓之6,(02)23144996
235,職業工會,臺北市網路技術研發人員職業工會,張惟皓,108,臺北市萬華區中華路1段182號1樓,(02)23213799
236,職業工會,臺北市解說員職業工會,黃美琇,116,臺北市文山區景華街47號,(02)29325187
237,職業工會,臺北市照顧服務員職業工會,吳秋燕,103,臺北市大同區重慶北路2段73巷27號3樓,(02)25502289
238,職業工會,臺北市小販業職業工會,廖年豐,103,臺北市大同區重慶北路3段223巷29號1樓,(02)25922391
239,職業工會,臺北市輔育人員職業工會,潘星渝,108,臺北市萬華區中華路1段182號1樓,(02)23213799
240,職業工會,臺北市餐盒製作包裝運送業職業工會,陳雅蓁,111,臺北市士林區社子街130號,(02)28110007
241,職業工會,臺北市木材裁剪加工運送職業工會,李信男,105,臺北市松山區三民路95巷32號,(02)27697852
242,職業工會,臺北市寵物服務員職業工會,馬慧男,100,臺北市中正區忠孝西路1段50號13樓之41,(02)23610869
243,職業工會,台北市保險服務業職業工會,李月嬌,103,臺北市大同區赤峰街23巷11號3樓,(02)25581950
244,職業工會,臺北市成衣熨燙人員職業工會,吳昭男,108,臺北市萬華區西寧南路132號3樓,(02)23317676
245,職業工會,臺北市中藥服務業職業工會,陳志朋,103,臺北市大同區保安街1之25號,(02)25520938
246,職業工會,臺北市影劇歌舞服務職業工會,曹莉,104,臺北市中山區復興北路62號3樓之2,(02)25151580
247,職業工會,臺北市特種飲食業從業人員職業工會,邱榮勳,110,臺北市信義區基隆路1段432號3樓301室,(02)27296635
248,職業工會,臺北市百貨公司售貨業職業工會,葉乾農,103,臺北市大同區長安西路33號8樓,(02)25507006
249,職業工會,臺北市拍賣人員職業工會,蔡式榖,105,臺北市松山區三民路95巷30號,(02)27697852
250,職業工會,臺北市地政士職業工會,"魏金珠 
劉玉霞
 廖碧蓮",106,臺北市大安區信義路4段109號4樓(被退件),(02)27044018
251,職業工會,臺北市車輛保管人員職業工會,沈秋娜,106,臺北市大安區市民大道3段144號4樓(被退件),
252,職業工會,台北市藝文創作人員職業工會,薄懷武,108,臺北市萬華區萬大路254號,(02)23073089
253,職業工會,臺北市勞動力服務人員職業工會,張惠琪,106,臺北市大安區新生南路1段155號5樓,(02)27077727
254,職業工會,臺北市禮儀服務業職業工會,葉謀聰,100,?臺北市中正區忠孝西路一段41號11樓之11,(02)25551707
255,職業工會,臺北市驗光配鏡人員職業工會,張重光,100,臺北市中正區愛國西路9號4樓之7,(02)23144996
256,職業工會,台北市婚禮設計服務人員職業工會,譚伊伶,104,臺北市中山區新生北路3段61號6樓之6,(02)25865078
257,職業工會,臺北市腳底按摩職業工會,郭建伸,104,臺北市中山區民權西路20號5樓之12,(02)25214525
258,職業工會,臺北市蛋類包裝業職業工會,高寶朝,100,臺北市中正區愛國西路9號3樓之15,(02)23618682
259,職業工會,臺北市芳薰香植物精油服務人員職業工會,姚思瑜,100,臺北市中正區忠孝西路1段41號11樓之11,(02)23913589
260,職業工會,臺北市安親班從業人員職業工會,謝美花,103,臺北市大同區赤峰街23巷11號3樓,(02)25582782
261,職業工會,臺北市保險代理職業工會,林恩永,104,台北市中山區民生東路一段 54 號 11 樓,(02)25719188
262,職業工會,臺北市汽車美容人員職業工會,鄭旭倫,104,臺北市中山區新生北路3段64號1樓,(02)25865236
263,職業工會,臺北市倉儲運輸從業人員業職業工會,莊月琴,103,臺北市大同區長安西路33號8樓,(02)25500687
264,職業工會,臺北市電腦用品運送服務人員職業工會,陳嘉添,104,臺北市中山區長春路26號8樓之3,(02)25119857
265,職業工會,臺北市鎖匙裝修職業工會,甘泰君,103,臺北市大同區甘州街22號3樓,(02)25573849
266,職業工會,臺北市框畫設計服務人員職業工會,鄭仁參,100,臺北市中正區杭州南路一段147號2樓,(02)23414719
267,職業工會,臺北市人體彩繪從業人員職業工會,丁存安,114,臺北市內湖區環山路2段53巷5弄18號1樓,(02)87973640
268,職業工會,臺北市指甲彩繪美容職業工會,陳寶華,106,臺北市大安區和平東路3段123號2樓,(02)87328567
269,職業工會,臺北市勞動力援助人員職業工會,沈鳳淳,116,臺北市文山區木柵路4段149巷13號2樓,(02)82301987
270,職業工會,臺北市保險經紀職業工會,許美鈴,103,臺北市大同區甘州街22號3樓,(02)25573849
271,職業工會,臺北市市場服務工作人員職業工會,黃秀玉,110,臺北市信義區松山路294號2樓,(02)27560959
272,職業工會,臺北市書籍雜誌運送人員職業工會,邱紹春,106,臺北市大安區溫州街22巷22號1樓(被退件，搬遷),(02)23699089
273,職業工會,臺北市窗簾設計製作服務人員職業工會,林千裕,104,臺北市中山區新生北路3段64號1樓,(02)25865136
274,職業工會,臺北市瑜珈教學人員職業工會,鄭賀文,104,臺北市中山區新生北路3段64號1樓,(02)25865236
275,職業工會,臺北市就業服務人員職業工會,廖沈玉梅,104,臺北市中山區民權西路20號5樓之12,(02)25214525
276,職業工會,臺北市牙體技術人員職業工會,吳乙男,111,臺北市中山區吉林路299巷13號1樓,(02)88614812
277,職業工會,臺北市廣告代理職業工會,黃如伶,251,新北市淡水區北新路197之1號23樓,(02)26292961
278,職業工會,臺北市大客車駕駛員職業工會 ,林帝傑,112,臺北市北投區大業路508號4樓,(02)28923148
279,職業工會,臺北市室內設計人員職業工會,張頌斌,103,臺北市大同區西寧北路83號6樓之2,(02)25561776
280,職業工會,臺北市道士法師服務職業工會,張倖瑜,103,臺北市大同區西寧北路83號6樓之2,(02)25561776
281,職業工會,台北市觀光領隊人員職業工會,馬潮,104,臺北市中山區林森北路289號7樓702室,(02)25415522
282,職業工會,臺北市工具車輛操作員職業工會,黃義傑,220,新北市板橋區文化路1段221巷2號,(02)89651858
283,職業工會,臺北市市場暨民意調查從業人員職業工會,吳奇璁,100,臺北市中正區忠孝西路1段41號11樓之11,(02)23751655
284,職業工會,臺北市咖啡加工職業工會,鄭旭芳,104,臺北市中山區新生北路3段64號1樓,(02)25865237
285,職業工會,台北市立體彩色印花從業人員職業工會,張雅茹,100,臺北市中正區杭州南路一段147號2樓,(02)25865237
286,職業工會,臺北市自備車輛計程車駕駛員職業工會,葉承源,108,臺北市萬華區西園路2段281巷28號1樓,(02)23031199
287,職業工會,臺北市廣告傳單發送服務人員職業工會,邱耀德,235,新北市中和區景平路140號3樓,(02)22305636
288,職業工會,臺北市電信人員職業工會,林家卉,100,臺北市中正區忠孝西路一段7號9樓之3,(02)23886960
289,職業工會,臺北市機車貨物運送職業工會,朱慶智,106,臺北市大安區杭州南路2段71號2樓,(02)23583192
290,職業工會,臺北市飲料運送服務職業工會,黃大宗,220,新北市板橋區文化路1段221巷2號,(02)89651858
291,職業工會,臺北市衛浴器材服務職業工會,郭泰緯,103,臺北市大同區長安西路33號8樓,(02)25500511
292,職業工會,臺北市汽車仲介業從業人員職業工會,"許恆銓
黃溪水
陳信佑",104,臺北市龍江路郵局121-53號信箱,(02)89815688
293,職業工會,臺北市骨節整復職業工會,邱九桁,104,台北市中山區吉林路286號5樓,(02)25235695
294,職業工會,臺北市歌舞藝能服務人員職業工會,余天,241,新北市三重區重陽路4段7號2樓,(02)29810067
295,職業工會,臺北市身心障礙者臨托居家服務業職業工會,陳繼東,104,臺北市中山區民生東路1段25號6樓之37,(02)25719957
296,職業工會,臺北市米食製品從業人員職業工會,蘇厚存,103,臺北市大同區長安西路33號8樓,(02)22575047
297,職業工會,臺北市蜜餞運送人員職業工會,許陳親,111,臺北市士林區重慶北路4段230號10樓,(02)28125822
298,職業工會,臺北市遊覽車駕駛員職業工會,黃瑞昌,112,臺北市北投區光明路217號12樓,(02)28911258
299,職業工會,臺北市醫務雜務職業工會,吳立人,100,臺北市中正區濟南路2段62巷11號1樓,(02)23222358
300,職業工會,臺北市紀錄片從業人員職業工會 ,廖建華,103,臺北市大同區興城街10巷16號2樓,(02)25571191
301,職業工會,臺北市銀行行員職業工會,蔡元鎮,100,臺北市中正區重慶南路1段2號2樓,
302,職業工會,臺北市不動產經紀人員職業工會,張瑋庭,108,臺北市萬華區中華路1段182號1樓,(02)23213799
303,職業工會,臺北市挽臉從業人員職業工會,甘沛琳,242,新北市新莊區新豐街20巷5號1樓,(02)22023083
304,職業工會,臺北市汽車電機冷氣保修業職業工會,劉君英,106,臺北市大安區和平東路3段406巷3號5樓,(02)27332211
305,職業工會,臺北市套房租賃仲介從業人員職業工會,黃美華,116,臺北市文山區景華街21號1樓,(02)29349828
306,職業工會,臺北市體育運動教練職業工會,吳永強,106,臺北市大安區和平東路3段11號B1,(02)27061215
307,職業工會,臺北市芳療整體保養職業工會,郭俶蓁,100,臺北市中正區愛國西路9號4樓之12,(02)23114128
308,職業工會,臺北市不鏽鋼門窗製作職業工會,徐暐翔,111,臺北市士林區葫蘆街110號,(02)28126837
309,職業工會,臺北市客車隨車服務人員職業工會,林芳薇,112,臺北市北投區大業路508號4樓,(02)28923148
310,職業工會,臺北市布花完稿設計職業工會,陳驛青,103,臺北市大同區重慶北路2段48號6樓,(02)25583580
311,職業工會,臺北市代客停車職業工會,陳余?,112,臺北市北投區光明路223號5樓(被退件),(02)28911250
312,職業工會,臺北市動物醫療從業人員職業工會,李亞霖,100,臺北市中正區濟南路2段62巷11號1樓,(02)23222358
313,職業工會,臺北市美容美髮用品從業人員職業工會,何思瑩,104,臺北市中山區長春路26號10樓之2,(02)25317981
314,職業工會,臺北市幼教從業人員職業工會,任台英,220,新北市板橋區中山路2段419號3樓,(02)89521816
315,職業工會,臺北市廣告服務業職業工會,陳彩柳,112,臺北市北投區明德路65號2樓,(02)28205949
316,職業工會,臺北市徵信服務職業工會,張重光,100,臺北市中正區愛國西路9號4樓之6,(02)23144996
317,職業工會,臺北市升學補習教學人員職業工會,林水和,103,臺北市大同區延平北路1段22號3樓之3,(02)25559880
318,職業工會,臺北市家庭教學服務人員職業工會,林亞駿,103,臺北市大同區延平北路1段22號3樓之3,(02)25559880
319,職業工會,臺北市古董藝品鑑識人員職業工會,疏淑媛,106,臺北市大安區復興南路2段151巷30弄15號17樓,
320,職業工會,臺北市停車收費員職業工會,陳勇安,114,台北市文山區景文街42號三樓303室,(02)86635281
321,職業工會,臺北市影視武術指導技藝從業人員職業工會,陳德維,114,台北市內湖區內湖路一段360巷8號8樓,(02)87978836
322,職業工會,臺北市藝術創作者職業工會,杜珮詩,103,臺北市大同區歸綏街97巷4號B1F,(02)25529159
323,職業工會,臺北市演藝經紀人職業工會,陳桓浩,104,臺北市中山區復興北路62號3樓之2,(02)25151580
324,職業工會,臺北市教師職業工會,葉青?,103,臺北市大同區大龍街187巷1號,(02)25960780
325,職業工會,臺北市勞工安全衛生管理職業工會,林政良,100,臺北市中正區愛國西路9號4樓之6,(02)23144996
326,職業工會,臺北市社會工作人員職業工會,陳欣涵,108,臺北市萬華區萬大路137巷14號1樓,
327,職業工會,臺北市下水道工程從業人員職業工會,邱建誠,105,臺北市松山區八德路4段245巷32弄42號6樓,(02)27486681
328,職業工會,台北市大專教師職業工會,丁一倪,106,臺北市大安區金華街78號7樓,(02)23910435
329,職業工會,臺北市紋身職業工會,李宛蓁,108,臺北市萬華區漢中街50巷6之3號,(02)23110378
330,職業工會,臺北市專業職能教學人員職業工會,蔣佩曄,241,新北市三重區重陽路一段113巷1弄46號,(02)89883150
331,職業工會,臺北市多層次傳銷人員職業工會,袁千富,104,臺北市中山區長安東路一段75號6樓,(02)25319393
332,職業工會,臺北市養生舒壓按摩職業工會,鄭文煌,104,臺北市中山區農安街32號7樓之1,(02)25975091
333,職業工會,臺北市庭園造景從業人員職業工會,沈嘉儀 ,103,臺北市大同區南京西路165號2樓,(02)25583911
334,職業工會,台北市動態藝術嘻哈文化業職業工會,黃心昱 ,104,臺北市中山區興安街112號2樓之5,(02)23888323
335,職業工會,臺北市新聞從業人員職業工會,鄭超文,106,臺北市大安區信義路2段88號9樓,(02)23410044
336,職業工會,臺北市企劃經理人職業工會,梁嘉琪,106,臺北市大安區羅斯福路2段91號16樓之2,(02)83691100
337,職業工會,臺北市微型影像製作人職業工會,吳宗建,106,臺北市大安區復興南路1段287號6樓之2,(02)27096960
338,職業工會,台北市商品包膜人員職業工會,林甬旂,111,臺北市士林區中山北路六段200號2樓,(02)88663185
339,職業工會,臺北市電信工程業職業工會,蔡勝和,100,臺北市中正區仁愛路1段42號7樓715室,(02)23975666
340,職業工會,臺北市洗鞋洗包從業人員職業工會,張高維,104,臺北市中山區中山北路3段29號5樓之2,(02)25993869
341,職業工會,台北市企業經營管理顧問從業人員職業工會,李王明暖,103,臺北市大同區民族西路169巷19號1樓,(02)25974399
342,職業工會,臺北市新娘秘書從業人員職業工會,陳韻竹,116,台北市文山區景文街42號三樓303室,(02)86635281
343,職業工會,臺北市特殊娛樂業從業人員職業工會,林瑞圖,104,臺北市中山區錦州街36號6樓,(02)25373355
344,職業工會,台北市音樂創作職業工會,陳玉貞,241,新北市三重區永福街289號5樓之1,(02)22861598
345,職業工會,臺北市藝品業職業工會,謝益芬,104,臺北市中山區錦州街5號3樓,(02)25651112
346,職業工會,台北市證券期貨職業工會,竇偉誠,235,"新北市中和區中原街152號12樓  
(舊地址：新北市中和區中原東街88號6樓)",(02)29597391
347,職業工會,臺北市醫師職業工會,陳宥任,106,臺北市大安區泰順街26巷39號2樓,
348,職業工會,臺北市產後照顧服務人員職業工會,王伯祥,106,臺北市大安區忠孝東路四段221號12樓,(02)87718228
349,職業工會,臺北市社區大學教學講師從業人員職業工會,張芳德,114,臺北市內湖區內湖路二段15號2樓,(02)87511587
350,職業工會,臺北市當舖從業人員職業工會,李宥德,105,臺北市松山區南京東路5段326號2樓,
351,職業工會,臺北市網路自媒體從業人員職業工會,陳界榕,100,臺北市中正區市民大道三段8號5樓81室,(02)23414588
352,職業工會,臺北市電競職業工會,陳奕,106,臺北市大安區新生南路二段30巷7號,(02)29266166
353,職業工會,臺北市數位遊戲職業工會,王緯菖,106,臺北市大安區和平東路1段66號9樓,
354,職業工會,臺北市光電檢測器材服務業職業工會,林毓峰,106,臺北市大同區重慶北路1段87號2樓,(02)25507773
355,職業工會,臺北市網路平台外送員職業工會,鄭力嘉,114,臺北市內湖區舊宗路二段181巷10號2樓,(02)26599999
356,職業工會,臺北市動漫企劃人員職業工會,劉佳豪,100,臺北市中正區和平西路一段64號,
357,職業工會,臺北市心理師職業工會,謝昀融,108,臺北市萬華區貴陽街二段153號,
358,職業工會,臺北市電傳勞務從業人員職業工會,邱秉正,104,臺北市中山區集英里23鄰撫順街39號10樓之1,
359,職業工會,臺北市公關業職業工會,陳大業,104,臺北市中山區林森北路105號5樓之2,(02)26932599
360,職業工會,臺北市娛樂公關經紀職業工會,胡筠筠,104,臺北市中山區林森北路101號2樓之1室,
361,職業工會,臺北市長期照顧服務人員職業工會,潘敏媛,108,臺北市萬華區中華路1段182號,(02)23703399
362,職業工會,臺北市健身教練職業工會,呂宇晟,104,臺北市中山區中山北路二段115巷39號1樓(須暫時改寄到41號，待開會變更會址),
363,職業工會,臺北市女子足球員職業工會,王湘惠,105,臺北市松山區南京東路四段171號12樓之2,
364,職業工會,臺北市數位科技動畫職業工會,曾品喬,235,新北市中和區板南路653號5樓,
365,職業工會,臺北市現場演出幕後技術工作者職業工會,陳雅婷,234,新北市永和區民生路25巷44號5樓2室,
366,職業工會,臺北市休閒服務人員職業工會,廖年豐,104,臺北市中山區撫順街16號8樓之1,
367,職業工會,臺北市廢棄物再利用處理職業工會,陳思宗,112,臺北市北投區公館路334巷10號,
368,職業工會,臺北市律師職業工會,楊佳陵,106,台北市大安區復興南路一段243號12樓,
369,職業工會,臺北市經絡調理服務人員職業工會,陳靜瑢,104,臺北市中山區撫順街16號8樓之1,
370,職業工會,臺北市醫院看護工作人員職業工會,陳昭志,112,臺北市北投區明德路267巷2號1樓,
371,職業工會,臺北市體適能指導工作人員職業工會,楊貫中,112,臺北市北投區中央北路１段12號4樓,(02)28913812
372,職業工會,臺北市運動賽事分析從業人員職業工會,蔡育庭,104,臺北市中山區五常街3號1樓,
373,職業工會,臺北市美體鬆筋調理員職業工會,張文瑜,106,臺北市大安區和平東路二段55號2樓,(02)23587182
374,職業工會,臺北市身心靈諮詢規劃從業人員職業工會,楊欽堯,106,臺北市大安區敦化南路二段180號21樓,(02)27200162
375,職業工會,臺北市職業籃球員職業工會,楊敬敏,105,臺北市松山區南京東路4段171號12樓之2,(02)87707278
376,職業工會,臺北市網路節目製作人員職業工會,巫俊毅,104,臺北市錦州街36號6樓,(02)25373355
377,職業工會,臺北市棋藝智力運動業職業工會,張恩齊,116,臺北市文山區景華街21號1樓,
378,職業工會,臺北市板車操作職業工會,唐雲銘,108,臺北市萬華區萬大路486巷37弄6號4樓,
379,職業工會,臺北市照護輔佐服務人員職業工會,張奎懷,103,台北市大同區赤峰街23巷11號2樓,(02)25581950
380,企業工會,臺北市臺灣菸酒股份有限公司臺北啤酒工場工會,吳國良,104,臺北市中山區八德路2段85號,(02)27719131
381,企業工會,士林紙業股份有限公司企業工會,許立明,327,桃園市新屋區笨港里文化路2段1631號,(03)4768077
382,企業工會,臺北市士林電機廠股份有限公司產業工會,羅美蓉,111,臺北市中山北路6段90號13樓,(03)5995111
383,企業工會,大同股份有限公司關係企業工會,王祥兆,104,臺北市中山區中山北路3段22號,(02)25941586
384,企業工會,臺北自來水事業處企業工會,莊瑛,106,臺北市大安區長興街131號,(02)87335618
385,企業工會,台北市國產實業建設股份有限公司台北廠工會,鄭世忠,115,臺北市南港區南港路3段33號,(02)26510998
386,企業工會,南僑投資控股股份有限公司企業工會 ,汪時渭,103,臺北市大同區延平北路4段100號,(02)66193000
387,企業工會,臺北市光華巴士股份有限公司企業工會, 陳星光,111,臺北市士林區中正路499號,(02)28826780
388,企業工會,台北市美商達美航空股份有限公司臺灣分公司企業工會,江志昌,100,"臺北市中正區開封街1段48號6樓之14
(1091108無法投遞被退件)",
389,企業工會,臺北市國興機電股份有限公司產業工會,陳榮仁,333,桃園市龜山區頂湖路33號,(03)3280199
390,企業工會,台北市中華電視股份有限公司企業工會,馬履芸,106,臺北市大安區光復南路116巷7號B3,(02)87723250
391,企業工會,臺北市中國廣播股份有限公司企業工會,蘇國生,104,臺北市中山區松江路375號10樓,(02)25005558
392,企業工會,香港商國泰航空有限公司台灣分公司企業工會,廖修暖,251,新北市淡水區後洲路1段58號23樓,
393,企業工會,臺北市中國電視事業股份有限公司企業工會,林棟梁,115,臺北市南港區重陽路118號B1,(02)27896670
394,企業工會,臺北市經濟日報股份有限公司產業工會,"王清啟
姚逸瀚
章顯恆",110,"臺北市信義區忠孝東路4段557號8樓
(1091113無法投遞被退件)",(02)27681233
395,企業工會,臺灣電視事業股份有限公司企業工會,莊勝鈞,105,臺北市松山區八德路3段10號,(02)27758888
396,企業工會,臺北市日立永大電梯公司企業工會,余杰翰,106,5臺北市大安區敦化南路2段63巷54弄6號1樓,(02)27093355
397,企業工會,臺北市臺灣菸酒股份有限公司酒類暨生技研究所工會,余新健,116,臺北市文山區羅斯福路6段142巷13號,(02)29301792
398,企業工會,臺北市財團法人臺灣敦睦聯誼會所屬作業組織圓山大飯店工會,張舉成,104,臺北市中山區中山北路4段1號,(02)28861818
399,企業工會,臺北市大南汽車股份有限公司企業工會,陳志忠,112,臺北市北投區中央北路4段601巷11號,(02)28586123
400,企業工會,臺北市中央電影事業股份有限公司製片廠產業工會,"廖本榕
邱文聰
邵立群",111,臺北市士林區至善路2段34號,(02)28829010
401,企業工會,臺北市日商日本航空股份有限公司台灣分公司企業工會,楊尚融,105,臺北市松山區民生東路3段138號11樓,(02)21755867
